[
  {
    "id": "paradiznik",
    "name": "Paradižnik",
    "latin": "Solanum lycopersicum",
    "group": "plodovke",
    "diff": 3,
    "beginner": "da",
    "balcony": "da",
    "raised": "da",
    "sun": "polno sonce",
    "soil": "rodovitna, odcedna tla; ne prenese zastajanja vode",
    "water": "redno, ob korenini; ne po listih",
    "spacing": "50–70 cm",
    "months": "februar;marec;april;maj;junij;julij;avgust;september",
    "harvest": "julij–september",
    "source": "kgzs_plodovke_lonce;ivr_paradiznikova_plesen;kgzs_dobri_sosedje",
    "desc": "Najbolj priljubljena plodovka za slovenski vrt; potrebuje toploto, oporo in redno oskrbo."
  },
  {
    "id": "paprika",
    "name": "Paprika",
    "latin": "Capsicum annuum",
    "group": "plodovke",
    "diff": 3,
    "beginner": "srednje",
    "balcony": "da",
    "raised": "da",
    "sun": "polno sonce",
    "soil": "topla, rodovitna, odcedna tla",
    "water": "redno in enakomerno",
    "spacing": "40–50 cm",
    "months": "februar;marec;april;maj;junij;julij;avgust;september",
    "harvest": "julij–september",
    "source": "kgzs_plodovke_lonce;ivr_portal",
    "desc": "Toploljubna plodovka; dobro uspeva v zaščiteni legi, loncu ali visoki gredi."
  },
  {
    "id": "kumare",
    "name": "Kumare",
    "latin": "Cucumis sativus",
    "group": "plodovke",
    "diff": 2,
    "beginner": "da",
    "balcony": "da",
    "raised": "da",
    "sun": "sonce do rahla polsenca",
    "soil": "humozna, topla, vlažna, a odcedna tla",
    "water": "zelo redno; pomanjkanje vode poslabša kakovost plodov",
    "spacing": "40–60 cm",
    "months": "april;maj;junij;julij;avgust;september",
    "harvest": "junij–september",
    "source": "kgzs_plodovke_lonce;ivr_pepelovke_bucevk",
    "desc": "Hitro rastoča bučevka za oporo ali tla; občutljiva na mraz in sušo."
  },
  {
    "id": "bucke",
    "name": "Bučke",
    "latin": "Cucurbita pepo",
    "group": "plodovke",
    "diff": 1,
    "beginner": "da",
    "balcony": "ne",
    "raised": "da",
    "sun": "polno sonce",
    "soil": "bogata, kompostirana, vlažna tla",
    "water": "redno in obilno ob korenini",
    "spacing": "80–100 cm",
    "months": "april;maj;junij;julij;avgust;september",
    "harvest": "junij–september",
    "source": "ivr_pepelovke_bucevk;kgzs_plodovke_lonce",
    "desc": "Ena najlažjih vrtnin za začetnike; potrebuje veliko prostora, hranil in vode."
  },
  {
    "id": "solata",
    "name": "Solata",
    "latin": "Lactuca sativa",
    "group": "listnata zelenjava",
    "diff": 1,
    "beginner": "da",
    "balcony": "da",
    "raised": "da",
    "sun": "sonce spomladi/jeseni, poleti polsenca",
    "soil": "rahla, zmerno hranljiva tla",
    "water": "stalna zmerna vlaga; ne presušiti",
    "spacing": "20–30 cm",
    "months": "februar;marec;april;maj;junij;avgust;september;oktober",
    "harvest": "april–junij; september–november",
    "source": "ivr_listne_usi_solatnice;kgzs_eknjiznica",
    "desc": "Osnovna vrtnina za začetnike; najbolje uspeva v hladnejšem delu sezone."
  },
  {
    "id": "spinaca",
    "name": "Špinača",
    "latin": "Spinacia oleracea",
    "group": "listnata zelenjava",
    "diff": 1,
    "beginner": "da",
    "balcony": "da",
    "raised": "da",
    "sun": "sonce do polsenca",
    "soil": "rahla, vlažna tla",
    "water": "redno; hitro gre v cvet ob suši in vročini",
    "spacing": "10–20 cm",
    "months": "marec;april;maj;avgust;september;oktober",
    "harvest": "april–junij; september–november",
    "source": "kgzs_eknjiznica;arso_agromet",
    "desc": "Hitra listnata vrtnina za pomlad in jesen; poleti jo pogosto zamenjajo druge listnate vrste."
  },
  {
    "id": "korenje",
    "name": "Korenje",
    "latin": "Daucus carota subsp. sativus",
    "group": "korenovke",
    "diff": 2,
    "beginner": "da",
    "balcony": "delno",
    "raised": "da",
    "sun": "sonce",
    "soil": "globoka, rahla tla brez svežega gnoja",
    "water": "enakomerna vlaga med kalitvijo",
    "spacing": "3–5 cm po redčenju",
    "months": "marec;april;maj;junij;julij;avgust;september;oktober",
    "harvest": "junij–november",
    "source": "kgzs_temp_tal;ivr_portal",
    "desc": "Zanesljiva korenovka, če so tla rahla in setev dovolj vlažna za kalitev."
  },
  {
    "id": "redkvica",
    "name": "Redkvica",
    "latin": "Raphanus sativus var. sativus",
    "group": "korenovke",
    "diff": 1,
    "beginner": "da",
    "balcony": "da",
    "raised": "da",
    "sun": "sonce do polsenca",
    "soil": "rahla, enakomerno vlažna tla",
    "water": "redno; suša povzroči olesenelost in pekoč okus",
    "spacing": "3–5 cm",
    "months": "marec;april;maj;september;oktober",
    "harvest": "april–junij; september–november",
    "source": "kgzs_temp_tal;ivr_kapusnice",
    "desc": "Zelo hitra vrtnina za začetnike; dobra za prazne prostore med počasnejšimi rastlinami."
  },
  {
    "id": "fizol_nizek",
    "name": "Nizek fižol",
    "latin": "Phaseolus vulgaris",
    "group": "stročnice",
    "diff": 2,
    "beginner": "da",
    "balcony": "delno",
    "raised": "da",
    "sun": "sonce",
    "soil": "topla, odcedna tla; ne preveč svežega gnojenja",
    "water": "zmerno; posebej ob cvetenju in nastavljanju strokov",
    "spacing": "8–10 cm v vrsti",
    "months": "maj;junij;julij;avgust;september",
    "harvest": "julij–september",
    "source": "ivr_fizolova_muha;kgzs_eknjiznica",
    "desc": "Toploljubna stročnica; ne hiti s setvijo v hladno in mokro zemljo."
  },
  {
    "id": "grah",
    "name": "Grah",
    "latin": "Pisum sativum",
    "group": "stročnice",
    "diff": 2,
    "beginner": "da",
    "balcony": "delno",
    "raised": "da",
    "sun": "sonce do polsenca",
    "soil": "odcedna, zmerno hranljiva tla",
    "water": "zmerno; ne mara suše med cvetenjem",
    "spacing": "5–8 cm",
    "months": "februar;marec;april;maj;junij",
    "harvest": "maj–julij",
    "source": "ivr_fizolova_muha;kgzs_eknjiznica",
    "desc": "Zgodnja stročnica za pomlad; potrebuje oporo pri višjih sortah."
  },
  {
    "id": "zelje",
    "name": "Zelje",
    "latin": "Brassica oleracea var. capitata",
    "group": "kapusnice",
    "diff": 3,
    "beginner": "srednje",
    "balcony": "ne",
    "raised": "da",
    "sun": "sonce",
    "soil": "hranilna, vlažna tla; dobro kolobarjenje",
    "water": "redno, posebej pri oblikovanju glav",
    "spacing": "40–60 cm",
    "months": "marec;april;maj;junij;julij;avgust;september;oktober",
    "harvest": "junij–november",
    "source": "ivr_kapusnice",
    "desc": "Klasična kapusnica; zahteva prostor, hranila in redno spremljanje škodljivcev."
  },
  {
    "id": "brokoli",
    "name": "Brokoli",
    "latin": "Brassica oleracea var. italica",
    "group": "kapusnice",
    "diff": 3,
    "beginner": "srednje",
    "balcony": "ne",
    "raised": "da",
    "sun": "sonce do rahla polsenca",
    "soil": "hranilna, vlažna tla",
    "water": "redno; suša poslabša tvorbo rož",
    "spacing": "40–50 cm",
    "months": "marec;april;maj;junij;julij;avgust;september;oktober",
    "harvest": "junij–oktober",
    "source": "ivr_kapusnice",
    "desc": "Uporabna kapusnica za pomlad in jesen; občutljiva na vročino in škodljivce."
  },
  {
    "id": "cebula",
    "name": "Čebula",
    "latin": "Allium cepa",
    "group": "čebulnice",
    "diff": 2,
    "beginner": "da",
    "balcony": "delno",
    "raised": "da",
    "sun": "sonce",
    "soil": "odcedna, ne preveč mokra tla",
    "water": "zmerno; manj ob dozorevanju",
    "spacing": "8–12 cm",
    "months": "marec;april;maj;junij;julij;avgust",
    "harvest": "julij–avgust",
    "source": "kgzs_eknjiznica;source_needed",
    "desc": "Osnovna čebulnica za vrt; ne mara zastajanja vode in pregoste saditve."
  },
  {
    "id": "cesen",
    "name": "Česen",
    "latin": "Allium sativum",
    "group": "čebulnice",
    "diff": 1,
    "beginner": "da",
    "balcony": "delno",
    "raised": "da",
    "sun": "sonce",
    "soil": "odcedna, rahla tla",
    "water": "zmerno; ne mara mokrih tal",
    "spacing": "10–15 cm",
    "months": "oktober;november;marec;april;maj;junij;julij",
    "harvest": "junij–julij",
    "source": "kgzs_eknjiznica;source_needed",
    "desc": "Zelo uporaben za začetnike; sadi se jeseni ali zgodaj spomladi."
  },
  {
    "id": "krompir",
    "name": "Krompir",
    "latin": "Solanum tuberosum",
    "group": "korenovke",
    "diff": 2,
    "beginner": "da",
    "balcony": "delno",
    "raised": "da",
    "sun": "sonce",
    "soil": "rahla, odcedna, zmerno bogata tla",
    "water": "zmerno; pomembno ob nastavljanju gomoljev",
    "spacing": "30–40 cm",
    "months": "marec;april;maj;junij;julij;avgust;september",
    "harvest": "junij–september",
    "source": "ivr_krompirjeva_plesen;ivr_portal",
    "desc": "Zanesljiva gomoljnica; spremljaj koloradskega hrošča in plesen v mokrem vremenu."
  },
  {
    "id": "bazilika",
    "name": "Bazilika",
    "latin": "Ocimum basilicum",
    "group": "zelišča",
    "diff": 1,
    "beginner": "da",
    "balcony": "da",
    "raised": "da",
    "sun": "sonce, toplo in zavetno",
    "soil": "rahla, hranilna, odcedna tla",
    "water": "redno, a brez zastajanja vode",
    "spacing": "20–30 cm",
    "months": "marec;april;maj;junij;julij;avgust;september",
    "harvest": "junij–september",
    "source": "kgzs_dobri_sosedje;kgzs_plodovke_lonce",
    "desc": "Toploljubno zelišče za lonce in ob paradižniku; ne mara mraza."
  },
  {
    "id": "petersilj_list",
    "name": "Listni peteršilj",
    "latin": "Petroselinum crispum",
    "group": "zelišča",
    "diff": 1,
    "beginner": "da",
    "balcony": "da",
    "raised": "da",
    "sun": "sonce do polsenca",
    "soil": "rahla, vlažna tla",
    "water": "redno, predvsem v loncih",
    "spacing": "15–20 cm",
    "months": "marec;april;maj;junij;julij;avgust;september;oktober",
    "harvest": "maj–november",
    "source": "kgzs_eknjiznica;source_needed",
    "desc": "Uporabno kuhinjsko zelišče; kalitev je lahko počasna, zato naj bo setev potrpežljiva."
  },
  {